<?xml version="1.0" encoding="utf-8"?>
<!DOCTYPE grouping_and_sorting_rules SYSTEM "grouping_and_sorting_rules.dtd" [
<!ENTITY ar SYSTEM "ar/ar.xml">
<!ENTITY bg SYSTEM "bg/bg.xml">
<!ENTITY ca SYSTEM "ca/ca.xml">
<!ENTITY cs SYSTEM "cs/cs.xml">
<!ENTITY da SYSTEM "da/da.xml">
<!ENTITY de SYSTEM "de/de.xml">
<!ENTITY el SYSTEM "el/el.xml">
<!ENTITY en SYSTEM "en/en.xml">
<!ENTITY es SYSTEM "es/es.xml">
<!ENTITY et SYSTEM "et/et.xml">
<!ENTITY fa SYSTEM "fa/fa.xml">
<!ENTITY fi SYSTEM "fi/fi.xml">
<!ENTITY fr SYSTEM "fr/fr.xml">
<!ENTITY he SYSTEM "he/he.xml">
<!ENTITY hi SYSTEM "hi/hi.xml">
<!ENTITY hr SYSTEM "hr/hr.xml">
<!ENTITY hu SYSTEM "hu/hu.xml">
<!ENTITY id SYSTEM "id/id.xml">
<!ENTITY is SYSTEM "is/is.xml">
<!ENTITY it SYSTEM "it/it.xml">
<!ENTITY ja SYSTEM "ja/ja.xml">
<!ENTITY kk SYSTEM "kk/kk.xml">
<!ENTITY km SYSTEM "km/km.xml">
<!ENTITY kn SYSTEM "kn/kn.xml">
<!ENTITY ko SYSTEM "ko/ko.xml">
<!ENTITY lo SYSTEM "lo/lo.xml">
<!ENTITY lv SYSTEM "lv/lv.xml">
<!ENTITY lt_ic SYSTEM "lt/lt.xml">
<!ENTITY ms SYSTEM "ms/ms.xml">
<!ENTITY my SYSTEM "my/my.xml">
<!ENTITY nl SYSTEM "nl/nl.xml">
<!ENTITY no SYSTEM "no/no.xml">
<!ENTITY pl SYSTEM "pl/pl.xml">
<!ENTITY pt SYSTEM "pt/pt.xml">
<!ENTITY ro SYSTEM "ro/ro.xml">
<!ENTITY ru SYSTEM "ru/ru.xml">
<!ENTITY sk SYSTEM "sk/sk.xml">
<!ENTITY si SYSTEM "si/si.xml">
<!ENTITY sl SYSTEM "sl/sl.xml">
<!ENTITY sv SYSTEM "sv/sv.xml">
<!ENTITY sw SYSTEM "sw/sw.xml">
<!ENTITY ta SYSTEM "ta/ta.xml">
<!ENTITY te SYSTEM "te/te.xml">
<!ENTITY tl SYSTEM "tl/tl.xml">
<!ENTITY th SYSTEM "th/th.xml">
<!ENTITY tr SYSTEM "tr/tr.xml">
<!ENTITY uk SYSTEM "uk/uk.xml">
<!ENTITY vi SYSTEM "vi/vi.xml">
<!ENTITY zh-CN SYSTEM "zh-CN/zh-CN.xml">
<!ENTITY zh-TW SYSTEM "zh-TW/zh-TW.xml">
]>
<grouping_and_sorting_rules xmlns="http://www.innodata-isogen.com/vocabularies/i18n_support/grouping_and_sorting_config">
    <metadata>
        <title>Sample Back-of-the-Book Index Rules</title>
        <description>
            <p>Demonstrates how to configure an internationalized index.</p>
        </description>
        <copyright>
            <p>Copyright (C) 2003, 2004 Innodata Isogen</p>
            <p>This sample may be used to create derivative text databases without restriction.</p>
        </copyright>
        <security>
            <p>For Public Use</p>
        </security>
        <revision_history>
            <revision>
                <date>2016-01-07</date>
                <author>Toshihiko Makita, Antenna House, Inc.</author>
                <description>
                    <p>Correct Ukrainian (uk) index configuration</p>
                    <p>Correct the "Y" position &amp; comment of Latvian.</p>
                </description>
            </revision>
            <revision>
                <date>2015-10-10</date>
                <author>Toshihiko Makita, Antenna House, Inc.</author>
                <description>
                    <p>Add (modify) xx-sort-rules.txt to sort Latin characters before non-Latin characters for DITA-OT 2.x.</p>
                    <p>- Arabic (ar)</p>
                    <p>- Bulgarian (bg)</p>
                    <p>- Greek (el)</p>
                    <p>- Persian (fa)</p>
                    <p>- Hebrew (he)</p>
                    <p>- Hindi (hi)</p>
                    <p>- Korean (ko): Also changed collator from Java to ICU.</p>
                    <p>- Kazakh (kk)</p>
                    <p>- Khmer (km)</p>
                    <p>- Kannada (kn)</p>
                    <p>- Myanmar (my)</p>
                    <p>- Russian (ru)</p>
                    <p>- Sinhala (si)</p>
                    <p>- Telugu (te)</p>
                    <p>- Thai (th)</p>
                </description>
            </revision>
            <revision>
                <date>2015-10-07</date>
                <author>Toshihiko Makita, Antenna House, Inc.</author>
                <description>
                    <p>Add Myanmar index configuration (my)</p>
                    <p>Add Hindi index configuration (hi)</p>
                    <p>Add Telugu index configuration (te)</p>
                    <p>Add Tamil index configuration (ta)</p>
                    <p>Add Kannada index configuration (kn)</p>
                    <p>Add Lao index configuration (lo)</p>
                    <p>Add Persian index configuration (fa)</p>
                    <p>Fix th bug: group_members/lastmember was not defined.</p>
                </description>
            </revision>
            <revision>
                <date>2015-03-26</date>
                <author>Toshihiko Makita, Antenna House, Inc.</author>
                <description>
                    <p>Fix Estonian index configuration. (et)</p>
                    <p>- Add "et-sort-rules.txt" to collation spec. Set primary difference between "v" nad "w".</p>
                    <p>  This is probably the ICU's collation definition mistake.</p>
                </description>
            </revision>
            <revision>
                <date>2014-12-20</date>
                <author>Toshihiko Makita, Antenna House, Inc.</author>
                <description>
                    <p>Fix Dutch index configuration. (nl)</p>
                    <p>- Add "Ä" to "A" entry.</p>
                    <p>Fix Romanian index configuration. (ro)</p>
                    <p>- Add U+0218, U+0219 to "Ş" entry.</p>
                    <p>- Add U+021A, U+021B to "Ţ" entry.</p>
                </description>
            </revision>
            <revision>
                <date>2014-08-20</date>
                <author>Toshihiko Makita, Antenna House, Inc.</author>
                <description>
                    <p>Refine Latvian index configuration. (lv)</p>
                    <p>- Set primary difference between following characters by introducing lv-sort-rules.txt.</p>
                    <p>  "A" and "Ā", "E" and "Ē", "I" and "Ī", "U" and "Ū"</p>
                    <p>Refine Lithuanian index configuration. (lt)</p>
                    <p>- Set primary difference between following characters by introducing lt-sort-rules.txt.</p>
                    <p>  "A" and "Ą", "E" and "Ę" and "Ė", "I" and "Į" and "Y", "U" and "Ų" and "Ū"</p>
                </description>
            </revision>
            <revision>
                <date>2014-04-27</date>
                <author>Toshihiko Makita, Antenna House, Inc.</author>
                <description>
                    <p>Refine Croatian index configuration. (hr)</p>
                    <p>- Add language code "hr-HR".</p>
                    <p>- Add "Dž" to "DŽ" entry.</p>
                    <p>- Add "Lj" to "LJ" entry.</p>
                    <p>- Add "Nj" to "NJ" entry.</p>
                    <p>Refine Estonian index configuration. (et)</p>
                    <p>- Change the alphabet order based on http://en.wikipedia.org/wiki/Estonian_alphabet</p>
                    <p>Refine Icelandic index configuration. (is)</p>
                    <p>- Add language code "is-IS".</p>
                    <p>Refine Latvian index configuration. (lv)</p>
                    <p>- Rename la.xml to lv.xml.</p>
                    <p>- Add language code "lv-LV"</p>
                    <p>Modify Lithuanian index configuration. (lt)</p>
                    <p>- Add language code "lt-LT"</p>
                    <p>- Add index group "Ą","Ę","Ė","Į","Ų","Ū".</p>
                    <p>Refine Slovenian index configuration. (sl)</p>
                    <p>- Add language code "sl-SI"</p>
                </description>
            </revision>
            <revision>
                <date>2014-04-26</date>
                <author>Toshihiko Makita, Antenna House, Inc.</author>
                <description>
                    <p>Add Tagalog index configuration for testing. (tl)</p>
                    <p>- Tagalog is used in Philippines.</p>
                    <p>Add Sinhala index configuration for testing. (si)</p>
                    <p>- Sinhala is used in  Sri Lanka.</p>
                    <p>Add Khmer index configuration for testing. (km)</p>
                    <p>- Khmer is used in  Cambodia.</p>
                    <p>Add Swahili index configuration for testing. (sw)</p>
                </description>
            </revision>
            <revision>
                <date>2014-04-15</date>
                <author>Toshihiko Makita, Antenna House, Inc.</author>
                <description>
                    <p>Add Kazakh index configuration for testing. (kk)</p>
                </description>
            </revision>
            <revision>
                <date>2013-12-31</date>
                <author>Toshihiko Makita, Antenna House, Inc.</author>
                <description>
                    <p>Change Thai last character from ໝ U+0EDD to ฮ U+0E2E.</p>
                    <p>U+0EDD is illegal for Thai because it belongs to Lao.</p>
                </description>
            </revision>
            <revision>
                <date>2013-12-27</date>
                <author>Toshihiko Makita, Antenna House, Inc.</author>
                <description>
                    <p>- Add "ms" entry.</p>
                    <p>- Change to use entity reference for each language.</p>
                </description>
            </revision>
            <revision>
                <date>2013-12-25</date>
                <author>Shinyu Murakami, Antenna House, Inc. (Toshihiko Makita, Antenna House, Inc)</author>
                <description>
                    <p>Modify "id" entry.</p>
                    <p>- Remove (comment out) java_collation_spec and uncertain entry members.</p>
                    <p>Add "vi-VN"</p>
                </description>
            </revision>
            <revision>
                <date>2013-11-01</date>
                <author>Toshihiko Makita, Antenna House, Inc.</author>
                <description>
                    <p>Modify "bg","ru" entry.</p>